{
  "elements": [
    {
      "escaped": "version_2_0_can_be_released",
      "id": "release:assembleConclusion",
      "label": "Version 2.0 can be released",
      "type": "conclusion"
    },
    {
      "escaped": "version_2_0_is_ready_to_ship",
      "id": "release:checked:ready",
      "label": "Version 2.0 is ready to ship",
      "type": "sub-conclusion"
    },
    {
      "escaped": "all_release_gates_pass",
      "id": "release:checked:gates",
      "label": "All release gates pass",
      "type": "strategy"
    },
    {
      "escaped": "the_code_is_tested",
      "aliases": [
        "release:checked:tests",
        "release:argued:tested"
      ],
      "id": "release:unified_0",
      "label": "The code is tested",
      "type": "sub-conclusion"
    },
    {
      "escaped": "the_release_is_documented",
      "id": "release:argued:done",
      "label": "The release is documented",
      "type": "sub-conclusion"
    },
    {
      "escaped": "the_changelog_and_api_docs_are_current",
      "id": "release:argued:docs",
      "label": "The changelog and API docs are current",
      "type": "strategy"
    },
    {
      "escaped": "the_test_suite_passes_with_high_coverage",
      "id": "release:argued:testing",
      "label": "The test suite passes with high coverage",
      "type": "strategy"
    },
    {
      "escaped": "the_test_suite_passes",
      "id": "release:argued:suite",
      "label": "The test suite passes",
      "type": "evidence"
    },
    {
      "escaped": "both_arguments_hold",
      "id": "release:assembleStrategy",
      "label": "Both arguments hold",
      "type": "strategy"
    }
  ],
  "name": "release",
  "type": "justification",
  "relations": [
    {
      "source": "release:assembleStrategy",
      "target": "release:assembleConclusion"
    },
    {
      "source": "release:checked:gates",
      "target": "release:checked:ready"
    },
    {
      "source": "release:argued:testing",
      "target": "release:unified_0"
    },
    {
      "source": "release:argued:docs",
      "target": "release:argued:done"
    },
    {
      "source": "release:unified_0",
      "target": "release:checked:gates"
    },
    {
      "source": "release:unified_0",
      "target": "release:argued:docs"
    },
    {
      "source": "release:argued:suite",
      "target": "release:argued:testing"
    },
    {
      "source": "release:checked:ready",
      "target": "release:assembleStrategy"
    },
    {
      "source": "release:argued:done",
      "target": "release:assembleStrategy"
    }
  ]
}