{
  "elements": [
    {
      "id": "E1",
      "label": "Test evidence",
      "type": "evidence"
    },
    {
      "id": "S1",
      "label": "Raise exception",
      "type": "strategy"
    }
  ],
  "name": "raise_exception",
  "relations": [
    {
      "source": "E1",
      "target": "S1"
    }
  ],
  "type": "justification"
}