{
  "elements": [
    {
      "escaped": "version_2_0_is_ready_to_ship",
      "id": "readiness:draft:ready",
      "label": "Version 2.0 is ready to ship",
      "type": "conclusion"
    },
    {
      "escaped": "all_release_gates_pass",
      "id": "readiness:draft:gates",
      "label": "All release gates pass",
      "type": "strategy"
    },
    {
      "escaped": "the_code_is_tested",
      "aliases": [
        "readiness:draft:tests",
        "readiness:tested:tested"
      ],
      "id": "readiness:hook",
      "label": "The code is tested",
      "type": "sub-conclusion"
    },
    {
      "escaped": "the_documentation_is_updated",
      "id": "readiness:draft:documented",
      "label": "The documentation is updated",
      "type": "sub-conclusion"
    },
    {
      "escaped": "the_changelog_and_api_docs_are_current",
      "id": "readiness:draft:docs",
      "label": "The changelog and API docs are current",
      "type": "strategy"
    },
    {
      "escaped": "the_changelog_is_up_to_date",
      "id": "readiness:draft:changelog",
      "label": "The changelog is up to date",
      "type": "evidence"
    },
    {
      "escaped": "the_test_suite_passes_with_high_coverage",
      "id": "readiness:tested:testing",
      "label": "The test suite passes with high coverage",
      "type": "strategy"
    },
    {
      "escaped": "the_test_suite_passes",
      "id": "readiness:tested:suite",
      "label": "The test suite passes",
      "type": "evidence"
    },
    {
      "escaped": "coverage_is_above_80",
      "id": "readiness:tested:coverage",
      "label": "Coverage is above 80%",
      "type": "evidence"
    }
  ],
  "name": "readiness",
  "type": "justification",
  "relations": [
    {
      "source": "readiness:draft:gates",
      "target": "readiness:draft:ready"
    },
    {
      "source": "readiness:tested:testing",
      "target": "readiness:hook"
    },
    {
      "source": "readiness:draft:docs",
      "target": "readiness:draft:documented"
    },
    {
      "source": "readiness:hook",
      "target": "readiness:draft:gates"
    },
    {
      "source": "readiness:draft:documented",
      "target": "readiness:draft:gates"
    },
    {
      "source": "readiness:draft:changelog",
      "target": "readiness:draft:docs"
    },
    {
      "source": "readiness:tested:suite",
      "target": "readiness:tested:testing"
    },
    {
      "source": "readiness:tested:coverage",
      "target": "readiness:tested:testing"
    }
  ]
}