{
  "elements": [
    {
      "id": "all",
      "label": "All conditions are met",
      "type": "strategy"
    },
    {
      "id": "grammar",
      "label": "Check Grammar/Typos",
      "type": "strategy"
    },
    {
      "id": "ready",
      "label": "Presentation is Ready",
      "type": "conclusion"
    },
    {
      "id": "legal",
      "label": "content is approved by legal",
      "type": "sub-conclusion"
    },
    {
      "id": "available",
      "label": "Slides are available",
      "type": "evidence"
    },
    {
      "id": "compliant",
      "label": "Check contents w.r.t. NDA",
      "type": "strategy"
    },
    {
      "id": "nda",
      "label": "NDA is signed",
      "type": "evidence"
    },
    {
      "id": "decent",
      "label": "Professional standard are met",
      "type": "sub-conclusion"
    }
  ],
  "name": "slides",
  "relations": [
    {
      "source": "legal",
      "target": "all"
    },
    {
      "source": "decent",
      "target": "all"
    },
    {
      "source": "available",
      "target": "grammar"
    },
    {
      "source": "all",
      "target": "ready"
    },
    {
      "source": "compliant",
      "target": "legal"
    },
    {
      "source": "available",
      "target": "compliant"
    },
    {
      "source": "nda",
      "target": "compliant"
    },
    {
      "source": "grammar",
      "target": "decent"
    }
  ],
  "type": "justification"
}
